,comment_id,product_id,guid,content,create_time,reference_id,reference_time,score,nickname
0,16005665742,10022150302950,05ebe2b5646cdcb40db7edc4fcb76939,"超级轻薄，带出去简直是装B神器&hellip;&hellip;哈哈，很好用，运行速度也还可以&hellip;&hellip;最近刚好需要，放在单位用完美，一边单位的电脑，一边中柏，不能太好了，哈哈
屏幕效果：超级清晰
散热性能：不错
外形外观：完美",2021-07-19 08:18:30,10022150302950,2021-07-13 13:23:46,5,****6
1,14526392915,10022150302950,5acb75f1353b03342532b9d9bff10803,款式是我喜欢的，外观多时尚的，带点粉棕紫色，整体看着相当大气，最重要的是做工精细，很有质感，笔记本运行非常流畅，音质很棒，声音是我比较满意的。快递也很快。还没有长期使用，但是屏幕和人性化是很认可的，店家很不错，很耐心的在处理我遇到的很多问题。很愉快的购物经历，有需要会再光顾。,2020-08-13 16:16:04,72016272308,2020-08-08 16:04:38,5,****0
2,14508200653,10022150302950,206f55db6e6378f668d7679b13b48654,"收到货了，本本真的很棒，金属外壳，视觉效果还有手感都相当好。最重要的音质好，声音大，很喜欢。A面十分简洁，整体非常协调而且时尚,在屏幕的设计上采用了超窄边框，左右边框的宽度仅有5mm,并且是钢化玻璃屏幕，看上去屏幕视野大，也更加适合长时间办公使用,支持180&deg;平铺,整机尺寸方面，机身很薄大概11.5mm厚度，重量1kg(实测)，这对于一个13.3英寸金属机身的笔记本来说，已经算是非常轻薄的了，机身有点粉紫色，不同光下呈现不同颜色，Type-C接口，可以拓展M2硬盘，随身携带出门能够满足各种移动场景的使用，文档办公、图形图像的处理等完全无压力。发货速度很快，隔天到！总体很满意！后期使用要是有什么问题再分享给大家",2020-08-08 14:32:58,72016272308,2020-08-06 15:32:56,5,布***安
3,14551087324,10022150302950,806934418f2a30faddddeb39c9377a39,这款做工非常好，非常大气漂亮，金属材质的质感很好，以前买过的中柏笔记本，质量很好的，相信中柏的质量，这次特地选的这款窄边框显示屏配置，显示效果确实不错，拿到手顺利开机，整个机器轻薄，但质感很强，携带很方便，我觉得自己选这款是正确的选择，良心款机型，做工质量好的很重要，声音很好，哈哈，看电影听音乐也不错！,2020-08-20 12:17:25,72016272308,2020-08-17 13:25:47,5,****i
4,15132250341,10022150302950,6a6137b4a68be3d28322921e6669b2db,宝贝收到几天了，故意满负荷试用了几天，很满意！首先是外观真漂亮，超薄，金属感，其次是运行很流畅，不管办公还是追剧画面很清晰，很爽，最后卖家服务很给力，耐心周到。,2021-01-04 08:43:49,72016272308,2020-12-29 13:12:41,5,****c
5,15428095537,10022150302950,79448bace028b80d74ce477d70f070e4,本本收到，外观很漂亮大气，时尚。开机速度还可以，办公，看视频很好。等用一段技渥菲馈Ｋ嬗么出差很方便，可处理日常文件。喜欢。,2021-03-16 19:49:08,72016272308,2021-03-11 01:08:58,5,l***h
6,14549042288,10022150302950,5797644d1be26bdce884640044c1924c,最近需要一台办公电脑，经过不断筛选，还在犹豫中，发现这款刚上市，没见过真机情况下、只在网上就看中了，立马下单，今天中午就收到了，第一眼感觉很商务，配置高，性价比也不错，就看接下来耐用不,2020-08-19 19:49:16,72016272308,2020-08-14 10:45:17,5,l***g
7,15696761351,10022150302950,03cbc783b37de20bdcde10b50e8be14d,非常值得入手，轻便美观，性能也不错，特别喜欢！,2021-05-20 16:58:50,72016272308,2021-05-16 13:18:40,5,****e
8,15419145415,10022150302950,03fed58e4088fab28c8fe16d9a59809e,外观没的说、太好看的、反应也很快、办公足够用了、音质也好、推荐、,2021-03-14 14:08:08,72016272308,2021-03-10 15:53:52,5,****f
9,15093047058,10022150302950,e60e2e84eddec250ea7cc90e53cfc308,刚收到打开一看很满意，金属材料，大小合适，有种新鲜感，买来办公的，实惠实用,2020-12-25 10:06:02,72016272308,2020-12-22 17:34:56,5,u***h
10,15550102152,10022150302950,3570f82320ad795603f16498734c7ea3,发的顺丰，送货很快。一直想买个不重的笔记本电脑，方便携带的，这个刚好，很轻，连电源都不重，很方便外出携带，办公学习都很方便。金属外盒也很炫酷。,2021-04-14 23:20:14,72016272308,2021-04-12 13:35:37,5,****S
11,15026442067,10022150302950,384f7aa7f26c3744a165780068981009,在大润发超市内的****店看见样机很漂亮，就来京东店买了一台，机器做工很精致漂亮，日常家庭使用性能足够，推荐购买，关键是做工精细颜值高。,2020-12-10 19:48:01,72016272308,2020-12-08 20:05:03,5,S***1
12,14546906107,10022150302950,e992e713a4bcdbb3f3533cdde947a098,"电脑收到了，很喜欢?运行不错，速度很快?
电脑很薄，轻盈，方便工作携带！手感很不错哟！
屏幕很大，基本无边框看电影，煲剧太爽了！外观简单大气上档次，私心感觉比苹果要更好看一些！！！",2020-08-19 10:04:21,72016272308,2020-08-09 15:09:15,5,****w
13,15397807643,10022150302950,d24c49a09df76053ef0d474620321095,"非常喜欢这个宝贝，机子本身质量超好，画面清晰度特别好高，音质可以说是相当不错了，我用来做文档办公，绝对够用了。
非常满意的一次购物，客服很耐心人很好，谢谢喽
如有需要还会回购
在此也谢谢快递小哥的周到服务",2021-03-08 22:53:19,72016272308,2021-03-02 14:49:20,5,w***g
14,15424374280,10022150302950,90af7aeb861eb486f11ec1d79a7f4694,用了几天才来评价，物美价廉，特别适合女孩用，学生上网课，办公用，开机速度快，分辨率蛮高的，很满意的一次购物，我还会介绍别给朋友来购买,2021-03-15 20:24:20,72016272308,2021-02-28 12:29:22,5,****8
15,14518775480,10022150302950,6cf6f8bad106179167b8d6d70d167909,"电脑还可以，流畅，刚开始用，新手，买给上学的妹妹用的，很喜欢，学生用的话足够，以下是一个文科生的评论
&quot;中柏X3轻薄本，比一张A4纸大那么两三厘米，体型小，重量少，适合携带。开机速度快，运行稳定，能用多久就有待验证了。嗯，画质清晰不模糊，声音够清够大，只要你不网卡，这种运行速度我觉得很可以。新电脑电量续航挺好，整体来说，嗯，可以。&quot;",2020-08-11 13:37:08,72016272308,2020-08-08 13:46:26,5,无***子
16,16460046019,10022150302950,d66b036cb8657cea3d52c56de35c1874,新电脑，就很卡，但是胜在便宜，将就用用可以,2021-10-14 13:31:08,10022150302950,2021-10-07 20:30:17,3,造***人
17,15347215694,10022150302950,02875da928495744fba9ad81992bf8fb,包装非常的严实，没有损坏，电脑的颜色是有点玫瑰金的感觉，非常的轻薄，第一次开机什么都没有，全部自己下载，价格非常的便宜，我就用来基础办公，网页上的小游戏玩起来没问题，目前没有卡顿，挺流畅的，非常满意,2021-02-24 13:36:35,72016272308,2021-02-18 16:38:32,5,****r
18,18442271221,10022150302950,9e265a9b865f51f8dfd39d8de71a761f,"运行速度：只上网课做PPT的话。在轻薄本里运行速度也非常非常的快，非常非常的好。
屏幕效果：屏幕真的是非常非常漂亮，非常的鲜亮明亮。
散热性能：因为只是做PPT和上网课，所以几乎没有发热。
外形外观：金属外壳非常的漂亮。",2022-11-26 00:50:21,10022150302950,2022-11-07 19:39:07,5,****d
19,15792510321,10022150302950,fc4117b256833a9a39a6bae3e8674f2e,"运行速度：办公，看手机数据日常使用很好用
屏幕效果：还可以，在这个价位很行了
散热性能：很ok
外形外观：好看好看",2021-06-11 12:40:16,72016272308,2021-06-01 13:12:31,5,****i
20,14720713218,10022150302950,f2897860c0e21863265d59601cafbe79,此款电脑开机设置需要一段时间，之后运行和开机就正常了，外观还是挺时尚的，大小合适，非常适合外出办公携带，小巧，轻便，全金属机身，质量用了几天，目前还没发现什么问题，店家发的顺风物流，包装还是挺严实的，有鼠标和充电器，耳机，没有键盘膜。总体还是很不错的。,2020-10-06 08:39:20,72016272308,2020-09-26 22:24:10,5,爱***1
21,16038695452,10022150302950,00bf994fda9dedbdff522e608c26bca8,电脑很好，开机9秒钟，只安装了微信优酷办公足够了,2021-07-25 18:25:53,10022150302950,2021-07-20 16:04:17,5,****e
22,15698424494,10022150302950,b698fded73d6f99c3c2c326bb6184c85,"外形外观：很漂亮，颜控
轻薄程度：轻薄超过我的想象
屏幕效果：屏幕效果很好",2021-05-21 00:45:18,10022150302951,2021-05-18 22:27:31,5,4***m
23,15871778339,10022150302950,785634c48bd54dbc7960a23c3f3f8be8,态度好物流快，。一直想买个不重的笔记本电脑，方便携带的，这个刚好，很轻，连电源都不重，很方便外出携带，办公学习都很方便。金属外盒也很炫酷。真的是太喜欢这款了,2021-06-26 14:36:00,10022150302951,2021-06-24 14:26:12,5,****h
24,15338305140,10022150302950,0e0b2d831b0182643ffd50c8c6363eca,电脑很轻 很方便 运行办公软件没什么问题 发热还可以接受 是可以扩展一块ssd很人性化 总体很满意,2021-02-21 22:32:06,72016272308,2021-02-18 19:24:17,5,z***1
25,17252212449,10022150302950,4fbef2c29aa13253b333239c63443732,"轻薄程度：完美，
屏幕效果：非常满意
运行速度：符合要求
其他特色：让买家放心。",2022-03-14 21:18:05,10022150302950,2022-03-11 14:11:57,5,****c
26,14514179111,10022150302950,7ea944067068931a308e600af2f1c66e,"运行速度：很快，不错呦
屏幕效果：清晰，高色域
散热性能：用来一天CPU温度是42度
外形外观：除了轻薄以外就是充分利用了空降，没有浪费的地方。
轻薄程度：真的很轻，作为一个老阿姨表示，一只手可以轻松托起100来回啊。
其他特色：客服相当的好，耐心，一步一步的帮我安装，指导。没有一丝丝的怨言，真是我遇到的最好的客服了。",2020-08-10 09:39:57,72016272308,2020-08-08 15:09:32,5,慕***鱼
27,15392084221,10022150302950,b5c28c23554f8009dfd39d8de71a761f,很轻薄，很方便，很适合办公，喜欢的可以下手，关注了很久，这次终于买到手了，我是做活动的时候买的。,2021-03-07 15:49:25,72016272308,2021-02-28 10:38:05,5,可***爱
28,16107990420,10022150302950,9568bd6757fde860fbe7973ace2b4e56,"刚刚拿到时感觉好轻连买的手机盒重都没有，以为买到假货了。
但是打开后电脑完美运行，看来还是孤陋寡闻了。
使用起来很好，个人觉得键盘的敲击感很好。

2000左右预算的话推荐购买。（如果有麦克风孔的话就更完美了）",2021-08-08 20:04:57,10022150302950,2021-08-03 16:49:36,5,星***辉
29,16118283715,10022150302950,3ac81b59d52fb7b5c2adc9625a13aaed,"外观材质：非常的好
屏幕效果：一级棒
运行速度：快，非常好",2021-08-11 12:04:25,10022150302950,2021-08-09 18:21:52,5,****4
